{
  "evaluation_id": "eval:axes:x402_b2b_seller_audit@1:564ead508e81c014",
  "requirement_profile_ref": "axes:x402_b2b_seller_audit@1",
  "requirement_profile_version": "1",
  "requirement_profile_hash": "038cb6cfa4256ec91b2ffb50570943c4e8a8dd881b972b719c5bf2041b283ee3",
  "hash_algorithm": "SHA-256",
  "subject_type": "bundle",
  "subject_hashes": [
    "564ead508e81c01446990b00a4e9def72b6f44e527f5e96d80090e5cb2012dfb"
  ],
  "evaluator_id": "axes:reference_evaluator@1",
  "evaluator_version": "1",
  "evaluated_at": "2026-10-04T00:00:00.000Z",
  "pinned_evidence_items": [],
  "results": [
    {
      "requirement_ref": "x402_correlation_01",
      "verification_state": "verified",
      "verification_subject_type": "artifact",
      "observed_note": "6 of 6 envelopes in scope: present",
      "evidence_refs": [
        "env:x402-b2b-vat/seller/0001",
        "env:x402-b2b-vat/seller/0002",
        "env:x402-b2b-vat/seller/0003",
        "env:x402-b2b-vat/seller/0004",
        "env:x402-b2b-vat/seller/0005"
      ]
    },
    {
      "requirement_ref": "x402_chain_01",
      "verification_state": "verified",
      "verification_subject_type": "artifact",
      "observed_note": "6 envelopes linked",
      "evidence_refs": []
    },
    {
      "requirement_ref": "x402_settlement_01",
      "verification_state": "verified",
      "verification_subject_type": "artifact",
      "observed_note": "1 of 1 envelopes in scope: committed terms equal the decoded settled artifact",
      "evidence_refs": [
        "env:x402-b2b-vat/seller/0004"
      ]
    },
    {
      "requirement_ref": "x402_settled_basis_01",
      "verification_state": "indeterminate",
      "verification_subject_type": "operator",
      "observed_note": "1 of 1 envelopes in scope: /settlement/settled_artifact basis_status simulated",
      "evidence_refs": [
        "env:x402-b2b-vat/seller/0004"
      ],
      "verification_reason_code": "absence",
      "verification_condition_code": "basis_not_demonstrated"
    },
    {
      "requirement_ref": "x402_anchor_01",
      "verification_state": "verified",
      "verification_subject_type": "artifact",
      "observed_note": "1 of 1 envelopes in scope: 2 qualifying anchors",
      "evidence_refs": [
        "env:x402-b2b-vat/seller/0006"
      ]
    },
    {
      "requirement_ref": "seller_buyer_01",
      "verification_state": "verified",
      "verification_subject_type": "artifact",
      "observed_note": "1 of 1 envelopes in scope: present",
      "evidence_refs": [
        "env:x402-b2b-vat/seller/0004"
      ]
    },
    {
      "requirement_ref": "seller_tax_01",
      "verification_state": "verified",
      "verification_subject_type": "artifact",
      "observed_note": "1 of 1 envelopes in scope: present",
      "evidence_refs": [
        "env:x402-b2b-vat/seller/0004"
      ]
    }
  ],
  "overall_verification_state": "indeterminate",
  "guarantee_type": "conditional",
  "conditional_requirement_refs": [
    "x402_settled_basis_01"
  ],
  "result_core_hash": "819a8217fc1fd1943f314c80be3cfa32cc5aebe3f08a0f3610830d529fe12c86"
}
